{
  "app_name": "gabo",
  "environment": "production",
  "assetRegistry": "worker_files/worker.assets.json",
  "workerScript": "worker_files/drastic-measures.gateway.js",
  "workerEndpoint": "https://drastic-measures.rulathemtodos.workers.dev",
  "assistantEndpoint": "https://drastic-measures.rulathemtodos.workers.dev/api/chat",
  "voiceEndpoint": "https://drastic-measures.rulathemtodos.workers.dev/api/voice",
  "ttsEndpoint": "https://drastic-measures.rulathemtodos.workers.dev/api/tts",
  "gatewayEndpoint": "https://drastic-measures.rulathemtodos.workers.dev",
  "workerEndpointAssetId": "96dd27ea493d045ed9b46d72533e2ed2ec897668e2227dd3d79fff85ca2216a569c4bf622790c6fb0aab9f17b4e92d0f8e0fa040356bee68a9c3d50d5a60c945",
  "gatewayEndpointAssetId": "96dd27ea493d045ed9b46d72533e2ed2ec897668e2227dd3d79fff85ca2216a569c4bf622790c6fb0aab9f17b4e92d0f8e0fa040356bee68a9c3d50d5a60c945",
  "allowedOrigins": [
    "https://www.gabos.io",
    "https://gabos.io",
    "https://chattiavato-a11y.github.io",
    "https://drastic-measures.rulathemtodos.workers.dev"
  ],
  "allowedOriginAssetIds": [
    "b91f605b23748de5cf02db0de2dd59117b31c709986a3c72837d0af8756473cf2779c206fc6ef80a57fdeddefa4ea11b972572f3a8edd9ed77900f9385e94bd6",
    "8cdeef86bd180277d5b080d571ad8e6dbad9595f408b58475faaa3161f07448fbf12799ee199e3ee257405b75de555055fd5f43e0ce75e0740c4dc11bf86d132",
    "b8f12ffa3559cee4ac71cb5f54eba1aed46394027f52e562d20be7a523db2a036f20c6e8fb0577c0a8d58f2fd198046230ebc0a73f4f1e71ff7c377d656f0756",
    "96dd27ea493d045ed9b46d72533e2ed2ec897668e2227dd3d79fff85ca2216a569c4bf622790c6fb0aab9f17b4e92d0f8e0fa040356bee68a9c3d50d5a60c945"
  ],
  "asset_identity": {
    "header_name": "x-ops-asset-id",
    "origin_to_asset_id": {
      "https://www.gabos.io": "b91f605b23748de5cf02db0de2dd59117b31c709986a3c72837d0af8756473cf2779c206fc6ef80a57fdeddefa4ea11b972572f3a8edd9ed77900f9385e94bd6",
      "https://gabos.io": "8cdeef86bd180277d5b080d571ad8e6dbad9595f408b58475faaa3161f07448fbf12799ee199e3ee257405b75de555055fd5f43e0ce75e0740c4dc11bf86d132",
      "https://chattiavato-a11y.github.io": "b8f12ffa3559cee4ac71cb5f54eba1aed46394027f52e562d20be7a523db2a036f20c6e8fb0577c0a8d58f2fd198046230ebc0a73f4f1e71ff7c377d656f0756",
      "https://drastic-measures.rulathemtodos.workers.dev": "96dd27ea493d045ed9b46d72533e2ed2ec897668e2227dd3d79fff85ca2216a569c4bf622790c6fb0aab9f17b4e92d0f8e0fa040356bee68a9c3d50d5a60c945"
    }
  },
  "requiredHeaders": [
    "Content-Type",
    "Accept",
    "X-Ops-Asset-Id"
  ],
  "headers": {
    "hop_header_name": "x-gabo-hop",
    "hop_header_value": "gateway",
    "language_hints": {
      "hint_header": "x-gabo-lang-hint",
      "list_header": "x-gabo-lang-list",
      "voice_language_header": "x-gabo-voice-language"
    },
    "optional_integrity_header": "x-ops-src-sha512-b64"
  },
  "routes": {
    "chat": "/api/chat",
    "voice": "/api/voice",
    "tts": "/api/tts",
    "health": "/health"
  },
  "timeouts": {
    "voice_timeout_sec": 120
  },
  "limits": {
    "max_body_chars": 8000,
    "max_messages": 30,
    "max_message_chars": 1000,
    "max_audio_bytes": 12582912
  },
  "cors": {
    "allow_methods": "GET, POST, OPTIONS",
    "allow_headers": [
      "content-type",
      "accept",
      "x-ops-asset-id",
      "x-ops-src-sha512-b64",
      "cf-turnstile-response",
      "x-gabo-origin",
      "x-gabo-lang-hint",
      "x-gabo-lang-list",
      "x-gabo-voice-language",
      "x-gabo-tinyml-mode",
      "x-gabo-honeypot",
      "x-gabo-honeypot-pre"
    ],
    "expose_headers": [
      "x-gabo-stt-iso2",
      "x-gabo-voice-timeout-sec",
      "x-gabo-tts-iso2",
      "x-gabo-lang-iso2",
      "x-gabo-model",
      "x-gabo-translated",
      "x-gabo-embeddings",
      "x-gabo-asset-verified"
    ],
    "max_age_sec": 86400
  },
  "notes": [
    "Canonical runtime config aligned to drastic-measures CF Worker gateway (HTML/CSS/JS frontend).",
    "Keep this file public; do not place any secrets here."
  ],
  "security_headers": {
    "x_frame_options": "DENY",
    "x_content_type_options": "nosniff",
    "referrer_policy": "strict-origin-when-cross-origin",
    "strict_transport_security": "max-age=31536000; includeSubDomains; preload",
    "cross_origin_resource_policy": "same-site",
    "cross_origin_opener_policy": "same-origin",
    "content_security_policy": "default-src 'self'; base-uri 'self'; object-src 'none'; frame-src 'none'; frame-ancestors 'none'; form-action 'self'; script-src 'self'; script-src-attr 'none'; style-src 'self' https://fonts.googleapis.com; style-src-attr 'none'; font-src 'self' https://fonts.gstatic.com; img-src 'self' data: https:; connect-src 'self' https://drastic-measures.rulathemtodos.workers.dev https://chattiavato-a11y.github.io; media-src 'self' blob:; manifest-src 'self'; worker-src 'self' blob:; upgrade-insecure-requests; block-all-mixed-content"
  },
  "seo": {
    "robots_index": true,
    "canonical_hosts": [
      "https://gabos.io",
      "https://www.gabos.io"
    ],
    "sitemap_path": "/sitemap.xml",
    "search_console_compatible": true
  },
  "integrity": {
    "algorithm": "sha512",
    "request_header": "x-ops-src-sha512-b64",
    "require_subresource_integrity": true,
    "notes": "Apply integrity attributes to external CDN resources in HTML templates."
  },
  "actions_handshake": {
    "ready": true,
    "path": "/__repo/handshake",
    "header_name": "x-gabo-repo-id",
    "algorithm": "shared-secret-header",
    "secret_name": "DRASTIC_MEASURES"
  }
}
